{
  "dayId":"DAY-TRACK-HUMAN-001-044","trackId":"TRACK-HUMAN-001","version":"0.1.0-draft","status":"RESEARCHED","professionalReview":"PENDING",
  "outlineRefs":{"capabilityIds":["CAP-011","CAP-012","CAP-013"],"claimIds":["CLM-PROCRASTINATION-001","CLM-MOTIVATION-001"],"patternIds":["PAT-001","PAT-003","PAT-029"],"practiceFamilyIds":["PRACTICE-DECISION-MAP"],"prerequisites":[7,11,41]},
  "content":{
    "dayNumber":44,"titleAr":"التسويف ليس دائمًا كسلًا",
    "objectiveAr":"بنهاية اليوم تستطيع تكوين فرضية مؤقتة عن تأجيل مهمة منخفضة المخاطر: نفور أو غموض أو خوف أو انخفاض قدرة أو قيد حقيقي، من دون تشخيص أو لوم.",
    "definitionSimpleAr":"التسويف تأخير اختياري لمهمة مقصودة رغم توقع تكلفة، لكنه لا يفسر وحده لماذا حدث ولا يثبت صفة الكسل.",
    "definitionDeepAr":"قد يحمل التأجيل راحة قصيرة من ملل أو غموض أو خوف تقييم، وقد ينتج من تعب أو ألم أو أولوية متعارضة أو نقص معلومة أو مورد. ليست كل مهام لم تُنجز تسويفًا: قد يكون التأجيل عقلانيًا أو مفروضًا. نستخدم خمسة مسارات كفرضيات قابلة للتصحيح، لا كاختبار شخصية، ونفصل بين ما يمكن تعديله وما يحتاج دعمًا أو تغيير توقعات.",
    "notThisAr":"هذا ليس تشخيص ADHD أو اكتئاب، ولا إعفاءً من أثر التأخير، ولا قاعدة أن كل تسويف سببه الخوف، ولا نصيحة بالضغط على نفسك.",
    "roleRelevanceAr":"تختلف الاستجابة إذا كانت الورقة غامضة، أو المهمة مكروهة، أو التقييم مخيفًا، أو الطاقة منخفضة، أو الموعد غير واقعي. تسمية المسار تمنع تكرار حلول لا تمس العائق.",
    "researchSaysAr":"وجدت مراجعة لعلاجات نفسية موجهة للتسويف أثرًا تجميعيًا صغيرًا ومتفاوتًا عبر عدد محدود من الدراسات. هذا يناقض وعد الحل السريع ويدعم فحص الآليات والسياق بدل الاختزال في الكسل.",
    "researchDoesNotProveAr":"لا تثبت المراجعة أن المسارات الخمسة تصنيف كامل، أو أن العلاج نفسه يناسب الجميع، أو أن التأجيل مرض، أو أن تحسين الدافعية سيحل القيد أو نقص القدرة.",
    "commonMisunderstandingAr":"قد تسأل «ليه أنا كده؟» فتنتج حكمًا شاملًا. السؤال العملي هو «ما الذي يجعل هذه المهمة، في هذا السياق، أصعب في البدء الآن؟».",
    "healthyExampleAr":"أجلت تقريرًا لأن المطلوب غير محدد؛ طلبت مثالًا ومعيارًا قبل البدء بدل تمديد ساعات العمل أو وصف نفسك بالمهمل.",
    "unhealthyExampleAr":"شربت منبهات وبقيت مستيقظًا لمعاقبة نفسك، أو رتبت المكتب مرارًا بدل سؤال الجهة عن الغموض، أو تجاهلت مرضًا وأطلقت عليه كسلًا.",
    "egyptianContextExampleAr":"قد يتأخر مشوار حكومي بسبب ورقة ناقصة أو مواصلات أو وقت عمل لا يسمح، لا بسبب دافعية. حدّد القيد قبل تحويله إلى عيب شخصي.",
    "selfCheckQuestionsAr":["هل اخترت التأخير رغم توفر بديل واقعي، أم كان مفروضًا؟","هل المهمة منفرة أم غير واضحة أم مرتبطة بخوف تقييم؟","هل لدي قدرة جسدية وذهنية كافية الآن؟","ما المورد أو الموافقة أو الوقت غير المتاح؟","ما معلومة واحدة ستفرق بين فرضيتين؟"],
    "action5MinAr":"اكتب اسم المهمة وخمسة احتمالات، ثم ضع «محتمل» أو «غير واضح» بجانب كل واحد. لا تختَر حلًا بعد.",
    "action15MinAr":"استرجع آخر مرتين أجلت فيهما المهمة وحدد ما سبق التأجيل وما الراحة القصيرة وما التكلفة. اختر فرضية واحدة وما قد يدحضها.",
    "fullPracticeAr":"اختر مهمة منخفضة المخاطر. افصل الواقعة عن الحكم، ثم افحص النفور والغموض والخوف والقدرة والقيد. لكل مسار اكتب دليلًا مؤيدًا أو ناقضًا من موقفين حديثين. حدد الفرضية الأقرب أو «لا أعرف»، ثم اختر معلومة صغيرة تجمعها غدًا. لا تصلح المهمة اليوم؛ الهدف تشخيص العائق على مستوى السلوك لا الشخص.",
    "whatNotToDoAr":["لا تستخدم بطاقة أعراض لتشخيص ADHD أو اكتئاب.","لا تعتبر الراحة أو تأجيل مهمة غير آمنة تسويفًا تلقائيًا.","لا تعالج انخفاض القدرة بحرمان النوم أو الطعام أو الدواء.","لا تجعل تحليل السبب شكلًا جديدًا من التأجيل المتكرر."],
    "patternToWatchAr":"راقب انتقال التأجيل إلى حكم «أنا كسول»، ثم حلول عامة كزيادة الضغط أو التخطيط الطويل من دون تحديد العائق.",
    "patternInterruptionAr":"استبدل الصفة بموقف ومهمة وسياق، واختر فرضية واحدة قابلة للدحض أو اكتب «غير واضح» ثم اجمع معلومة واحدة فقط.",
    "microExperimentAr":"قارن مهمتين: واحدة بدأت فيها وأخرى أجلتها. حدد فرقًا واحدًا في الوضوح أو النفور أو الخوف أو القدرة أو القيد، بلا تعميم.",
    "realWorldMissionAr":"قبل تأجيل مهمة بسيطة اليوم، سم المسار الأقرب أو «لا أعرف» وسجل معلومة واحدة تحتاجها. لا تجبر نفسك على البدء ضمن المهمة.",
    "relationshipPracticeAr":{"applicable":true,"textAr":"بدل اتهام شخص بالكسل، اسأل إن كان مناسبًا وآمنًا: «إيه اللي مانع البداية: المطلوب مش واضح، الوقت، ولا حاجة تانية؟». لا تطلب إفصاحًا صحيًا."},
    "environmentChangeAr":"ضع سؤال المهمة أو المستند الناقص في موضع ظاهر خاص، لا قائمة لوم طويلة. إذا كانت الخصوصية ضعيفة، استخدم رمزًا محايدًا أو لا تخزن.",
    "fullModeAr":"حلل موقفين وافحص المسارات الخمسة وحدد فرضية قابلة للدحض. الزمن 20–30 دقيقة.",
    "standardModeAr":"افحص مهمة واحدة واختر فرضية أو «لا أعرف» ومعلومة تالية. الزمن 8–12 دقيقة.",
    "minimumModeAr":"قل: «أنا مأجل المهمة، والسبب مش واضح بعد» أو سم عائقًا واحدًا. لا يلزم البدء.",
    "failureResponseAr":"إذا لم تعرف السبب، توقف عن التحليل ولا تختر «كسل» كإجابة افتراضية. اطلب توضيحًا أو راقب موقفًا واحدًا، وإن كان التعطل واسعًا ومستمرًا ففكر في مساعدة مهنية.",
    "tooEasyAr":"اختر مهمتين مؤجلتين لأسباب مختلفة واقترح لماذا سيضر استخدام الحل نفسه معهما.",
    "tooHardAr":"استخدم مثال التقرير الغامض وحدد الفرق بين الغموض ونقص القدرة فقط.",
    "reflectionAr":"أي فرضية كانت أسرع في ذهنك، وما الدليل الذي قد يثبت أنك مخطئ؟ هل كان التأجيل اختياريًا فعلًا؟",
    "journalPromptsAr":["ما الراحة القصيرة التي أحصل عليها من التأجيل؟","أي قيد حقيقي أحوله إلى لوم؟","متى يصبح تحليل السبب نفسه تجنبًا؟"],
    "noticeTomorrowAr":"لاحظ نقطة الاحتكاك الأقرب في مهمة واحدة، ثم طابقها مع مدخل مختلف بدل حل عام.",
    "tomorrowPreparationAr":"اختر تجربة مرة واحدة آمنة وقابلة للإلغاء، ولا تستخدم موعدًا حرجًا أو مهمة عالية العواقب.",
    "roleSpecificAdaptationAr":"للمدير أو المعلم، افحص وضوح التكليف والموارد والعبء قبل وصف المتأخر. للمتعلم أو الموظف، اطلب معيارًا أو أولوية محددة من دون كشف صحي غير لازم.",
    "specialContextAdaptationsAr":["مع مرض أو ألم أو نوم شديد الاضطراب: انخفاض القدرة احتمال جاد يحتاج رعاية لا ضغطًا.","مع فقر أو مواصلات أو رعاية: سجّل القيد الهيكلي ولا تقدمه كمشكلة دافعية.","مع خوف من عنف أو انتقام: عدم تنفيذ الطلب قد يكون حماية؛ لا تستخدم تجربة مواجهة.","مع أعراض بدأت منذ الصغر وتظهر في أكثر من مجال: لا تشخّص ذاتيًا واطلب تقييمًا مؤهلًا إن كان التعطل واضحًا.","مع جهاز مشترك: لا تكتب تفاصيل وظيفة أو صحة أو نزاع قد تُستخدم ضدك."],
    "safetyNoteAr":{"applicable":true,"textAr":"لا تطبق التحليل على دواء أو طوارئ أو قيادة أو التزام سلامة. لا تستخدم الحرمان أو الألم أو التهديد لعلاج التأجيل."},
    "professionalHelpThresholdAr":{"applicable":true,"textAr":"إذا كان التأجيل مستمرًا ويعطل العمل أو الدراسة أو الرعاية أو يرتبط باكتئاب شديد أو قلق أو قهر أو أعراض انتباه واسعة، فقد يفيد تقييم مهني مناسب."},
    "primarySourceIds":["SRC-ROZENTAL-2018-PROCRASTINATION","SRC-GILLISON-2019-SDT-MOTIVATION","SRC-SHEERAN-2020-SDT-BEHAVIOR"],
    "additionalSourceIds":[],
    "evidenceStrength":{"rating":"LIMITED","explanationAr":"أثر التدخلات المجمّع صغير ومتفاوت وقاعدة الدراسات محدودة؛ المسارات الخمسة أداة تنظيمية لا تصنيفًا مثبتًا كاملًا."},
    "researchLimitationAr":"الدراسات قليلة وغير مصرية وتختلف في التعريفات والتدخلات، ولا تفصل دائمًا بين التأجيل الاختياري والقيود أو الأسباب الصحية والتنفيذية.",
    "optionalDeepDiveAr":{"applicable":true,"textAr":"راجع SRC-ROZENTAL-2018-PROCRASTINATION لحجم الأثر الصغير والتغاير، وSRC-GILLISON-2019-SDT-MOTIVATION وSRC-SHEERAN-2020-SDT-BEHAVIOR لحدود تفسير الدافعية."},
    "completionWithoutPerfectionAr":"يكفي استبعاد وصمة الكسل أو تحديد فرضية مؤقتة أو «لا أعرف». لا يلزم بدء المهمة أو حل السبب أو تسجيل تفاصيل."
  }
}
