{
  "dayId":"DAY-TRACK-HUMAN-001-056","trackId":"TRACK-HUMAN-001","version":"0.1.0-draft","status":"RESEARCHED","professionalReview":"PENDING",
  "outlineRefs":{"capabilityIds":["CAP-023","CAP-024"],"claimIds":["CLM-RELATIONSHIP-001","CLM-RELATIONSHIP-SAFETY-001"],"patternIds":["PAT-012","PAT-013","PAT-057"],"practiceFamilyIds":["PRACTICE-BOUNDARY-PLAN"],"prerequisites":[4,55]},
  "content":{
    "dayNumber":56,"titleAr":"قول لا لا يحتاج محاكمة الطرف الآخر",
    "objectiveAr":"بنهاية اليوم تستطيع صياغة رفض مختصر يحدد قدرتك أو اختيارك وحد الخطوة التالية، من دون تشخيص أو إهانة أو تبرير لا ينتهي، مع بديل غير مباشر عند الخطر.",
    "definitionSimpleAr":"الرفض الواضح يقول إنك لن تفعل طلبًا أو لن تستمر في سلوك محدد، وقد يذكر نطاقًا أو بديلًا من غير محاكمة الشخص.",
    "definitionDeepAr":"«لا» حد للفعل أو القدرة أو الاختيار، وليست حكمًا على قيمة الطرف الآخر. قد تكون: لا أستطيع، لا أوافق، أو لن أكمل إذا استمر السلوك. التبرير القصير قد يفيد، لكنه ليس جلسة دفاع. البديل اختياري وليس ثمنًا لحقك في الرفض. وعندما توجد سلطة أو اعتماد أو عنف، قد يكون الرفض المباشر خطرًا؛ يمكن استخدام تأجيل أو قناة مكتوبة أو وسيط أو خطة أمان.",
    "notThisAr":"هذا ليس عقابًا أو صمتًا انتقاميًا أو تهديدًا أو قطعًا شاملًا، ولا دليلًا أن الآخر سام، ولا قاعدة أن المباشرة آمنة دائمًا.",
    "roleRelevanceAr":"في العمل والأسرة والصداقة، يمنع الرفض المحدد موافقة مترددة تتحول لاستياء، لكنه يحتاج حساب القوة والمال والسكن والرعاية والانتقام قبل الكلام.",
    "researchSaysAr":"تظهر بحوث تعليم التواصل والحزم آثارًا متواضعة ومتفاوتة، بينما لا تكفي تمارين التواصل العامة أمام السيطرة أو العنف؛ سلامة المتضرر تتقدم على المواجهة أو الحل المشترك.",
    "researchDoesNotProveAr":"لا تثبت الأدلة أن قول لا يحسن العلاقة، أو أن النص المباشر مناسب للجميع، أو أن الرفض بلا تكلفة، أو أن كل إلحاح إساءة، أو أن الوسيط يضمن الأمان.",
    "commonMisunderstandingAr":"قد تجمع لائحة اتهامات لتبرير الرفض. يكفي تحديد ما لن تفعله وما ستفعله إن استمر الطلب، من دون إثبات أن الطرف الآخر سيئ.",
    "healthyExampleAr":"قلت: «مش هقدر أستلم مهمة إضافية الأسبوع ده. لو لازم تتعمل، محتاجين نغير الأولوية أو الموعد».",
    "unhealthyExampleAr":"قلت: «أنت استغلالي ومش هتعرف تكلمني تاني»، أو وافقت خوفًا ثم عاقبت بالصمت، أو واجهت شخصًا هددك سابقًا وحدك.",
    "egyptianContextExampleAr":"في طلب عائلي قد تقول: «مش هقدر أدفع المبلغ ده. أقدر أساعد في الاتصال أو جزء أصغر»، من دون كشف كل دخلك أو اتهام الأقارب.",
    "selfCheckQuestionsAr":["ما الطلب أو السلوك الذي أرفضه تحديدًا؟","هل السبب قدرة أم اختيار أم سلامة؟","هل الرفض المباشر آمن مع هذه القوة؟","هل أريد بديلًا أم أقدمه من الذنب؟","ما الخطوة إذا استمر الضغط؟"],
    "action5MinAr":"اكتب: «لا أستطيع/لن أفعل… أستطيع… إن أردت». احذف الصفات والتاريخ والتبرير الزائد.",
    "action15MinAr":"صمم ثلاث درجات: رفض مباشر، تأجيل للمراجعة، وقناة أو وسيط أكثر أمانًا. اختر الأنسب لا الأكثر جرأة.",
    "fullPracticeAr":"اختر موقفًا منخفض المخاطر. حدد الفعل والقدرة والاختيار والقوة. صغ رفضًا من جملة أو جملتين وبديلًا اختياريًا وحد تكرار. تدرب بصوت محايد أو كتابة. إن كان آمنًا، قل الرفض مرة واحدة ثم كرره دون شرح جديد عند الإلحاح. إذا ظهر تهديد، توقف وانتقل للمسافة والدعم ولا تطبق التدريب.",
    "whatNotToDoAr":["لا تشخّص أو تهين أو تجمع أخطاء الماضي.","لا تقدم بديلًا يضر قدرتك كي تجعل الرفض مقبولًا.","لا تواجه شخصًا عنيفًا أو مسيطرًا لاختبار الحد.","لا تستخدم الصمت أو الحرمان أو قطع الموارد لمعاقبة الرفض."],
    "patternToWatchAr":"راقب شرحًا يتوسع مع كل اعتراض حتى يتحول الرفض لتفاوض قسري، أو موافقة ظاهرية يعقبها غضب وانسحاب.",
    "patternInterruptionAr":"كرر المعنى نفسه: «مش متاح». لا تضف سببًا جديدًا، وانتقل لخطة الأمان أو إنهاء الحديث إذا تحول الضغط لتهديد.",
    "microExperimentAr":"ارفض طلبًا بسيطًا مرة واحدة بجملة قصيرة، ولا تقدم بديلًا إلا إذا أردته. لاحظ قدرتك على التوقف عن التبرير.",
    "realWorldMissionAr":"قل لا أو اطلب وقتًا لطلب منخفض المخاطر، واحترم حق الطرف الآخر في الشعور من دون التراجع التلقائي.",
    "relationshipPracticeAr":{"applicable":true,"textAr":"قل: «مش هقدر أعمل ده. أقدر أعمل… لو مناسب، ولو لأ فمحتاجين بديل تاني». عند الإلحاح: «إجابتي ما تغيرتش»."},
    "environmentChangeAr":"اختر قناة تقلل الضغط مثل رسالة موثقة أو وجود شخص داعم، ولا تحفظ تفاصيل حساسة على جهاز مشترك.",
    "fullModeAr":"صمم الرفض ودرجة الأمان والبديل وحد الإلحاح، وتدرب أو نفذ. الزمن 20–25 دقيقة.",
    "standardModeAr":"اكتب جملة رفض وخطوة عند الإلحاح. الزمن 8–12 دقيقة.",
    "minimumModeAr":"قل «محتاج وقت أفكر» أو اكتب «لا». لا يلزم مواجهة حقيقية.",
    "failureResponseAr":"إذا بررت طويلًا أو وافقت، لا تعاقب نفسك. صحح لاحقًا إن كان آمنًا: «راجعت قدرتي ومش هقدر»، أو استخدم وسيطًا أو اترك الموقف.",
    "tooEasyAr":"ميز بين رفض طلب، وحد سلوك، وإنهاء علاقة أو دور، وحدد اختلاف العواقب والمشورة المطلوبة.",
    "tooHardAr":"استخدم مثالًا خياليًا لرفض موعد غير مناسب ولا ترسله.",
    "reflectionAr":"هل حددت الفعل أم حاكمت الشخص؟ هل كان الرفض حرًا وآمنًا، وهل البديل اختيار أم ذنب؟",
    "journalPromptsAr":["ما السبب الذي أظن أنني يجب أن أثبته؟","متى يكون التأجيل أكثر أمانًا من لا مباشرة؟","أي بديل أقدمه وأنا لا أريده؟"],
    "noticeTomorrowAr":"لاحظ دعمًا وعبئًا وحدًا داخل الأسرة من دون افتراض أن كل قرب آمن أو كل رعاية ظلم.",
    "tomorrowPreparationAr":"اختر مثالًا منخفض الحساسية أو خياليًا، ولا تستخدم سرًا أو عنفًا أو صراعًا ماليًا كبيرًا.",
    "roleSpecificAdaptationAr":"لصاحب السلطة، لا تعاقب رفض طلب اختياري ولا تقدمه كاختيار زائف. لمن سلطته أقل، قد يكون التوثيق أو الوسيط أو عدم المواجهة أكثر أمانًا.",
    "specialContextAdaptationsAr":["مع عنف أو تهديد: لا تقل لا مباشرة إذا زاد الخطر؛ استخدم خطة أمان ودعمًا متخصصًا.","مع اعتماد مالي أو سكني: افحص البدائل والانتقام قبل الرفض ولا تلُم نفسك على التدرج.","مع عمل: ميز بين تكليف رسمي وطلب اختياري واطلب توضيح الأولويات.","مع رعاية: لا تترك شخصًا معتمدًا في خطر؛ اطلب تغطية وحدودًا قابلة للتنفيذ.","مع طفل أو تابع: لا تستخدم الحرمان من الاحتياجات كحد."],
    "safetyNoteAr":{"applicable":true,"textAr":"الرفض المباشر ليس واجبًا عندما يوجد عنف أو سيطرة أو انتقام. لا تختبر شخصًا مؤذيًا؛ استخدم مسافة ووسيطًا وخطة أمان ومساعدة مناسبة."},
    "professionalHelpThresholdAr":{"applicable":true,"textAr":"إذا كان قول لا يقابل بتهديد أو عنف أو مراقبة أو حرمان، أو إذا كنت محاصرًا باعتماد خطِر، فاطلب دعمًا متخصصًا وعاجلًا عند الخطر."},
    "primarySourceIds":["SRC-BLANCHARD-2009-COUPLE-COMMUNICATION","SRC-OMURA-2017-ASSERTIVENESS","SRC-KARANTZAS-2023-RELATIONSHIP-AGGRESSION"],
    "additionalSourceIds":["SRC-WHO-2014-IPV-HANDBOOK"],
    "evidenceStrength":{"rating":"MIXED","explanationAr":"توجد آثار متواضعة لتدريب التواصل والحزم، مع دليل واضح أن العنف والسيطرة يحتاجان سلامة لا مهارة حوار عامة؛ الصياغة المحددة غير مثبتة."},
    "researchLimitationAr":"الأدلة غير مصرية ومتخصصة، ولا تحدد تكلفة الرفض عبر الأسرة والعمل والنوع والاعتماد الاقتصادي. خدمات الدعم المحلية تحتاج تحققًا حاليًا.",
    "optionalDeepDiveAr":{"applicable":true,"textAr":"راجع SRC-OMURA-2017-ASSERTIVENESS للحزم، وSRC-KARANTZAS-2023-RELATIONSHIP-AGGRESSION وSRC-WHO-2014-IPV-HANDBOOK لحدود التواصل عند العنف."},
    "completionWithoutPerfectionAr":"يكفي صياغة لا أو اختيار تأجيل أو عدم مواجهة لأجل الأمان. لا يلزم قولها أو تبريرها أو تقديم بديل أو كسب موافقة الطرف الآخر."
  }
}
