{
  "dayId":"DAY-TRACK-HUMAN-001-063","trackId":"TRACK-HUMAN-001","version":"0.1.0-draft","status":"RESEARCHED","professionalReview":"PENDING",
  "outlineRefs":{"capabilityIds":["CAP-024","CAP-026"],"claimIds":["CLM-RELATIONSHIP-001","CLM-DEBIASING-001"],"patternIds":["PAT-034","PAT-039"],"practiceFamilyIds":["PRACTICE-COMMUNICATION-SCRIPT"],"prerequisites":[22,53,55,62]},
  "content":{
    "dayNumber":63,"titleAr":"صف الواقعة قبل الاتهام",
    "objectiveAr":"بنهاية اليوم تستطيع صياغة افتتاح خلاف آمن يصف سلوكًا أو اتفاقًا محددًا وأثرًا وطلبًا، دون قراءة نية أو إطلاق صفة شخصية.",
    "definitionSimpleAr":"وصف الواقعة يذكر ما أمكن رؤيته أو سماعه أو الاتفاق عليه، ثم أثره، بدل تفسير دوافع الشخص كحقيقة.",
    "definitionDeepAr":"نبدأ بما يمكن للطرفين مراجعته: وقت، كلمة، فعل، أو اتفاق. ثم نذكر أثرًا نملكه وطلبًا محددًا. «وصل الملف بعد الموعد المتفق عليه» أضيق من «أنت لا تحترمني». قد تكون النية مهمة لاحقًا، لكننا لا نعرفها من السلوك وحده. الوصف ليس محضر محكمة ولا يضمن عدم الدفاعية، ولا يُستخدم إذا فشل فحص الأمان أو إذا كانت الواقعة تحتاج قناة رسمية أو مشورة.",
    "notThisAr":"هذا ليس تجميلًا للضرر أو منعًا لتسمية عنف أو تمييز وفق معايير مناسبة، ولا مطالبة بإثبات كل تفصيل، ولا تقنية لمواجهة شخص غير آمن.",
    "roleRelevanceAr":"في العمل والأسرة والصداقة، يقلل الافتتاح المحدد مساحة النزاع حول الهوية، ويسمح بمراجعة اتفاق أو أثر أو طلب واحد بدل محاكمة العلاقة كلها.",
    "researchSaysAr":"تظهر برامج التواصل آثارًا متواضعة ومتفاوتة ولا تثبت جملة عالمية. وتظهر مراجعات تقليل الانحياز نجاحًا جزئيًا خاصًا بالمهمة دون ضمان نقل دائم، ما يدعم تواضع الاستدلال لا وعدًا بحل الخلاف.",
    "researchDoesNotProveAr":"لا تثبت الأدلة أن الوصف يقلل التصعيد، أو أن روايتك كاملة، أو أن تجنب قراءة النية يلغي تحيزات أخرى، أو أن كل خلاف مناسب للحوار المباشر.",
    "commonMisunderstandingAr":"قد تخفي الاتهام داخل كلمة تبدو وصفية مثل «تجاهلتني». الأكثر قابلية للفحص: «أرسلت رسالتين ولم يصل رد حتى الموعد الذي اتفقنا عليه».",
    "healthyExampleAr":"قلت: «اتفقنا على إرسال الجزء صباح الاثنين، ووصل الثلاثاء من غير تنبيه؛ ده عطّل الدمج. محتاج نحدد موعدًا واقعيًا وطريقة إبلاغ».",
    "unhealthyExampleAr":"قلت: «أنت مستهتر وأناني كالعادة»، أو جمعت خمس سنوات من الوقائع، أو استخدمت وصفًا هادئًا ظاهريًا لتهديد الطرف الآخر.",
    "egyptianContextExampleAr":"في حديث عائلي قد تقول: «الموضوع اتقال قدام الضيوف رغم إني طلبت يفضل خاص، وده ضايقني. مش هناقشه قدام حد» بدل «إنتوا بتحبوا الفضيحة».",
    "selfCheckQuestionsAr":["هل اجتاز الموقف فحص الأمان؟","ما الذي رُصد أو اتُّفق عليه؟","ما الذي افترضته عن النية؟","ما الأثر المحدد الذي أملكه؟","ما الطلب أو الحد الواحد؟"],
    "action5MinAr":"اكتب افتتاحًا من ثلاثة أجزاء: واقعة، أثر، طلب أو حد. ضع خطًا على الصفات وكلمات «دائمًا» و«أبدًا».",
    "action15MinAr":"حوّل ثلاث اتهامات إلى أوصاف قابلة للمراجعة، ثم اكتب معلومة ناقصة قد تغير كل وصف.",
    "fullPracticeAr":"اختر موقفًا منخفض المخاطر اجتاز اليوم 62. اكتب روايتك الأولية ثم افصل المشاهدة عن التفسير والصفة. صغ افتتاحًا بواقعة واحدة وأثر واحد وطلب واحد، واكتب سؤال تصحيح: «هل في معلومة فاتتني؟». تدرب مرة. لا تبدأ الحديث إذا تغير الأمان أو الخصوصية أو الاستثارة، واستخدم قناة رسمية عند الحاجة.",
    "whatNotToDoAr":["لا تستخدم دائمًا وأبدًا أو تشخيصًا أو قراءة نية.","لا تجمع وقائع كثيرة لإغراق الطرف الآخر.","لا تحول الوصف إلى استجواب أو تسجيل سري.","لا تستخدمه مع عنف أو تهديد أو انتقام محتمل."],
    "patternToWatchAr":"راقب الانتقال من فعل إلى هوية، والبحث عن أمثلة قديمة تثبتها، ثم رفض أي معلومة لا تناسب القصة.",
    "patternInterruptionAr":"ارجع لأحدث واقعة واحدة، اذكر ما لا تعرفه، واطلب تصحيحًا أو فعلًا واحدًا. أجّل الباقي.",
    "microExperimentAr":"في موقف بسيط، قل الواقعة من دون صفة ثم اسأل عن معلومة ناقصة. لاحظ هل تغير فهمك لا هل وافق الآخر.",
    "realWorldMissionAr":"استخدم افتتاحًا واحدًا في خلاف منخفض المخاطر أو أرسله للمراجعة إلى نفسك فقط؛ توقف إذا ظهرت إهانة أو تصاعد.",
    "relationshipPracticeAr":{"applicable":true,"textAr":"قل: «لما حصل… كان الأثر… ومحتاج… هل في معلومة ناقصة عندي؟». لا تضف «لأنك دائمًا…»."},
    "environmentChangeAr":"اختر وقتًا بلا جمهور وقناة قابلة للتوقف، ولا تسجل الحديث. إن كان رسميًا، استخدم توثيقًا واقعيًا لا أوصافًا شخصية.",
    "fullModeAr":"افصل الواقعة والتفسير وصغ افتتاحًا وسؤال تصحيح وتدرب. الزمن 20–25 دقيقة.",
    "standardModeAr":"اكتب واقعة وأثرًا وطلبًا واحدًا. الزمن 8–12 دقيقة.",
    "minimumModeAr":"احذف صفة واحدة من جملة خلاف، أو اختر عدم الحديث. هذا إكمال صالح.",
    "failureResponseAr":"إذا بدأت باتهام، لا تضاعف الشرح. قل: «صياغتي كانت حكمًا. الواقعة اللي أقصدها…». وإذا تصاعد الموقف، توقف وفق خطة الأمان.",
    "tooEasyAr":"صغ روايتين للواقعة نفسها من زاويتين وحدد ما يمكن التحقق منه وما يظل تفسيرًا.",
    "tooHardAr":"استخدم مثال تأخر ملف خيالي وحدد الواقعة فقط.",
    "reflectionAr":"أي كلمة بدت وصفًا وهي تفسير؟ ما المعلومة التي قد تغير القصة، وهل ظل الطلب واحدًا؟",
    "journalPromptsAr":["أي صفة أستخدمها بدل الواقعة؟","متى أجمع الماضي لأثبت نيتي عن الآخر؟","ما القناة الرسمية الأنسب لبعض الوقائع؟"],
    "noticeTomorrowAr":"لاحظ إشارة تصاعد في خلاف آمن وحدد توقفًا له سبب ومدة وطريقة عودة، لا صمتًا عقابيًا.",
    "tomorrowPreparationAr":"اختر خلافًا منخفض المخاطر يمكن إيقافه، وحدد وقت عودة واقعيًا ولا تستخدم علاقة غير آمنة.",
    "roleSpecificAdaptationAr":"لصاحب السلطة، وصف الواقعة لا يلغي أثر السلطة أو حق التابع في قناة رسمية. لمن سلطته أقل، الوثائق والوسيط قد يكونان أنسب من افتتاح مباشر.",
    "specialContextAdaptationsAr":["مع عنف أو تحكم: لا تستخدم الافتتاح؛ انتقل للأمان.","مع تحرش أو تمييز: يمكن تسمية السلوك بوضوح واستخدام قناة رسمية دون الدخول في جدال نية.","مع طفل: استخدم فعلًا وأثرًا مناسبين للعمر ولا تصفه بصفة ثابتة.","مع اختلاف لغة أو وصول: اختر وسيلة مفهومة ووقتًا للتصحيح.","مع جهاز مشترك: لا تحفظ سجل خلاف حساس."],
    "safetyNoteAr":{"applicable":true,"textAr":"لا تستخدم التدريب إذا لم يجتز فحص الأمان. الوصف الهادئ لا يجعل المواجهة آمنة عند العنف أو السيطرة أو الانتقام."},
    "professionalHelpThresholdAr":{"applicable":true,"textAr":"إذا تكرر الخلاف مع خوف أو تهديد أو عنف أو تحرش أو تعطّل شديد، استخدم دعمًا متخصصًا أو رسميًا مناسبًا وعاجلًا عند الخطر."},
    "primarySourceIds":["SRC-BLANCHARD-2009-COUPLE-COMMUNICATION","SRC-OMURA-2017-ASSERTIVENESS","SRC-LUDOLPH-2018-DEBIASING"],
    "additionalSourceIds":["SRC-WHO-2014-IPV-HANDBOOK"],
    "evidenceStrength":{"rating":"LIMITED","explanationAr":"توجد آثار تواصل متواضعة ونجاحات جزئية في تقليل بعض الانحيازات، لكن الافتتاح المحدد ونقله وأمانه لم تُثبت مباشرة."},
    "researchLimitationAr":"الأدلة غير مصرية ومهام تقليل الانحياز لا تمثل الخلاف الواقعي. تحتاج اللغة والسلطة والقنوات الرسمية والأمان اختبارًا محليًا.",
    "optionalDeepDiveAr":{"applicable":true,"textAr":"راجع SRC-BLANCHARD-2009-COUPLE-COMMUNICATION وSRC-OMURA-2017-ASSERTIVENESS للتواصل، وSRC-LUDOLPH-2018-DEBIASING لحدود انتقال تقليل الانحياز."},
    "completionWithoutPerfectionAr":"يكفي فصل واقعة عن تفسير أو حذف صفة أو اختيار عدم الحديث. لا يلزم فتح خلاف أو إقناع الطرف الآخر أو حسم النية."
  }
}
