{
  "dayId": "DAY-TRACK-HUMAN-001-023",
  "trackId": "TRACK-HUMAN-001",
  "version": "0.1.0-draft",
  "status": "RESEARCHED",
  "professionalReview": "PENDING",
  "outlineRefs": {
    "capabilityIds": ["CAP-004", "CAP-019"],
    "claimIds": ["CLM-RUMINATION-001"],
    "patternIds": ["PAT-004", "PAT-005", "PAT-054"],
    "practiceFamilyIds": ["PRACTICE-THOUGHT-NOTE"],
    "prerequisites": [21, 22]
  },
  "content": {
    "dayNumber": 23,
    "titleAr": "الاجترار يشبه الحل لكنه لا يتحرك",
    "objectiveAr": "بنهاية اليوم تستطيع التمييز بين تفكير ينتج معلومة أو خطوة، وتكرار يزيد الضيق من دون جديد، ثم اختيار توقف مناسب.",
    "definitionSimpleAr": "التفكير المفيد يضيف معلومة أو قرارًا أو فعلًا؛ الاجترار يعيد السؤال أو الحكم نفسه من دون حركة واضحة.",
    "definitionDeepAr": "ليس كل تفكير مؤلم اجترارًا، وليس كل تكرار مرضًا. قد تحتاج مراجعة أمر معقد أكثر من مرة. الإشارة العملية هي الوظيفة: هل ظهرت معلومة جديدة أو سؤال قابل للإجابة أو خطوة أو قبول لحد؟ أم أن الحلقة تكرر لماذا أنا هكذا أو ماذا لو بلا معيار توقف؟ هذا وصف غير تشخيصي، ويجب ألا يصبح مراقبة لكل فكرة.",
    "notThisAr": "هذا ليس أمرًا بإيقاف التفكير بالقوة، ولا علاجًا للاجترار أو القلق، ولا حكمًا أن الحزن أو محاولة الفهم مضيعة وقت.",
    "roleRelevanceAr": "بعد خلاف أو قرار أو خطأ، قد يبدو إعادة السيناريو مسؤولية. تحديد مخرج التفكير يحفظ التعلم ويمنع أن يتحول الدور كله إلى محكمة داخلية.",
    "researchSaysAr": "تفرق الأدلة بين التفكير السلبي المتكرر وكل أشكال التأمل، ولا تدعم اختزاله في ضعف إرادة أو تحكم عام. الارتباطات بعمليات التحكم صغيرة ومحددة، وكانت فوائد تدخلات الاجترار والقلق أوضح مع تقديم مهني. لذلك لا يعالج متزن الحلقة؛ يقدم فحص وظيفة قصيرًا وعتبة مساعدة.",
    "researchDoesNotProveAr": "لا تثبت الأدلة أن أي تفكير متكرر اجترار، أو أن حدًا زمنيًا يوقفه، أو أن الشخص يستطيع الخروج منه بالإرادة وحدها.",
    "commonMisunderstandingAr": "قد تقول «أنا بفكر عشان أفهم» بينما تعيد السؤال نفسه بلا معلومة. أو قد تسمي مراجعة عملية مرة ثانية اجترارًا لمجرد أنها مزعجة؛ افحص الناتج.",
    "healthyExampleAr": "راجعت خطأ إرسال، عرفت سببه وعدلت إعدادًا واعتذرت، ثم أوقفت إعادة المشهد لأن الخطوة والمعلومة اكتملتا.",
    "unhealthyExampleAr": "كررت «ليه أنا دايمًا كده؟» ساعات، بحثت عن إجابة نهائية لشخصيتك، ورفضت الراحة لأنك ظننت استمرار الألم دليل جدية.",
    "egyptianContextExampleAr": "بعد تعليق عائلي محرج قد تعيد كل رد كان ممكن تقوله. إذا لم توجد مواجهة آمنة أو معلومة جديدة، قد تكون الخطوة دعمًا أو حدًا لاحقًا أو ترك الحلقة اليوم.",
    "selfCheckQuestionsAr": [
      "ما السؤال الذي أكرره بالحرف أو المعنى؟",
      "ما المعلومة الجديدة في آخر دورة؟",
      "هل ظهر قرار أو خطوة أو حد؟",
      "هل أبحث عن يقين أو تفسير كامل للشخصية؟",
      "ما عتبة الضيق أو الوقت التي تجعلني أتوقف أو أطلب دعمًا؟"
    ],
    "action5MinAr": "اكتب السؤال المتكرر، ثم أكمل: «الجديد هو…» أو «لا يوجد جديد». إذا لا يوجد، اختر فعلًا خارجيًا قصيرًا أو توقفًا.",
    "action15MinAr": "ارسم عمودين: تفكير ينتج، وتفكير يعيد. ضع مثالًا واحدًا، وحدد مخرجًا: معلومة أو خطوة أو قبول مجهول أو دعم.",
    "fullPracticeAr": "اختر حلقة منخفضة الحساسية. سجل السؤال مرة، وما تعرفه، وما لا تعرفه، وآخر معلومة جديدة. حدد هل يمكن لسؤال محدد أو فعل صغير تحريكها. إن لم يمكن، ضع حدًا قصيرًا وانتقل إلى نشاط خارجي متفق عليه. لا تعاود السجل في اليوم نفسه، وسجل إن زاد الضيق بدل إجبار الاستمرار.",
    "whatNotToDoAr": [
      "لا تحاول طرد الفكرة بالقوة أو تعاقب نفسك على عودتها.",
      "لا تحول فحص الاجترار إلى سجل متكرر لكل فكرة.",
      "لا تترك إصلاحًا أو خطرًا حقيقيًا باسم وقف التفكير.",
      "لا تستخدم الدرس بدل علاج أو دعم عند تعطّل مستمر."
    ],
    "patternToWatchAr": "راقب سؤالًا بلا معيار إجابة، وإعادة الماضي بحثًا عن رد مثالي، واعتبار استمرار التفكير دليل اهتمام أو مسؤولية.",
    "patternInterruptionAr": "اسأل: «ما الجديد وما المخرج؟». إن لم يوجد، سمِّ الحلقة وانتقل إلى خطوة خارج الذهن أو دعم أو راحة بلا جدال إضافي.",
    "microExperimentAr": "أوقف حلقة عادية بعد فحص جديد واحد وانتقل لدقيقتين من فعل حسي أو عملي. لاحظ الإمكان لا اختفاء الفكرة.",
    "realWorldMissionAr": "حوّل سؤالًا متكررًا إلى سؤال معلومات لشخص أو مصدر مناسب، أو اكتب قرارًا واضحًا بأن المعلومة غير متاحة الآن.",
    "relationshipPracticeAr": {
      "applicable": true,
      "textAr": "اطلب من شخص آمن نوع دعم محدد: «محتاج تسمعني خمس دقائق من غير ما نعيد تحليل الموضوع». لا تجعله مسؤولًا عن طمأنتك مرارًا."
    },
    "environmentChangeAr": "ضع تذكيرًا محايدًا: «ما الجديد؟ ما المخرج؟» مع نشاط بديل جاهز، ولا تحفظ موضوع الحلقة إذا كان حساسًا.",
    "fullModeAr": "نفذ فحص الوظيفة والمخرج والحد والنشاط البديل مرة واحدة. الزمن 20–25 دقيقة.",
    "standardModeAr": "اكتب السؤال والجديد والمخرج، ثم توقف. الزمن 8–10 دقائق.",
    "minimumModeAr": "قل: «مفيش جديد دلوقتي» وانتقل لفعل خارجي دقيقة واحدة أو للراحة.",
    "failureResponseAr": "إذا عادت الحلقة فورًا، لا تعاود الورقة. لاحظ العودة وارجع للنشاط أو اطلب دعمًا؛ العودة لا تعني أنك نفذت خطأ.",
    "tooEasyAr": "فرّق بين حلقة تحتاج معلومة وحلقة تحتاج قرارًا وحلقة لا تملكها، واكتب معيارًا يمنع التحليل الزائد لكل نوع.",
    "tooHardAr": "لا تستخدم موضوعًا شخصيًا. لاحظ فقط أنك تكرر سؤالًا، ووجّه انتباهك لخمسة أشياء تراها ثم توقف.",
    "reflectionAr": "هل التفكير اليوم أنتج جديدًا أم كان يعيد؟ وما المخرج الأقل ضررًا الذي اخترته؟",
    "journalPromptsAr": [
      "أي سؤال لا يملك إجابة كاملة لكنه يطلبها مني؟",
      "متى أخلط بين الألم والتعلم؟",
      "من أين أطلب دعمًا بلا طمأنة متكررة؟"
    ],
    "noticeTomorrowAr": "لاحظ نقطة يمكن عندها تحويل التفكير إلى فعل صغير أو ترك مؤقت. لا تختبر ذلك في موضوع خطر.",
    "tomorrowPreparationAr": "اختر حلقة يومية خفيفة وحدد فعلًا خارجيًا آمنًا ومدة توقف قصيرة قبل تجربة الغد.",
    "roleSpecificAdaptationAr": "في العمل، افصل مراجعة خطأ ذات إجراء عن إعادة لوم النفس. في الأسرة، لا تجعل وقف الحلقة يعني تجاهل إصلاح أو حد آمن.",
    "specialContextAdaptationsAr": [
      "مع اكتئاب أو قلق معطل: لا تعتمد على مهارة ذاتية وحدها واطلب تقييمًا مناسبًا.",
      "مع وسواس: تجنب سؤال «هل هذه حلقة؟» بصورة متكررة واطلب علاجًا متخصصًا.",
      "مع صدمة: لا تراجع الحدث وحدك؛ اختر تأريضًا ودعمًا.",
      "مع قلة الخصوصية: لا تكتب محتوى السؤال؛ استخدم رمزًا أو لا تحفظ.",
      "مع مشكلة عملية عاجلة: نفذ خطوة الأمان أو الإصلاح قبل حد التفكير."
    ],
    "safetyNoteAr": {
      "applicable": true,
      "textAr": "إذا زاد التمرين الضيق أو أعاد ذكرى مؤذية أو صار فحصًا قهريًا، توقف. لا تستخدمه لإبطال خطر أو تأخير مساعدة."
    },
    "professionalHelpThresholdAr": {
      "applicable": true,
      "textAr": "إذا استمر التفكير المتكرر وأعاق النوم أو العمل أو الدراسة أو العلاقات، أو ارتبط بإيذاء النفس أو خطر، فاطلب دعمًا مهنيًا مناسبًا وعاجلًا عند الخطر."
    },
    "primarySourceIds": ["SRC-ZETSCHE-2018-RNT-CONTROL", "SRC-MCCARRICK-2021-RUMINATION-WORRY"],
    "additionalSourceIds": [],
    "evidenceStrength": {
      "rating": "LIMITED",
      "explanationAr": "الأدلة ترفض اختزال التفكير المتكرر في عيب تحكم عام وتدعم تدخلات مهنية بدرجات، لكنها لا تثبت هذا الفحص الذاتي القصير."
    },
    "researchLimitationAr": "المراجعات دولية وبها مقاييس وآليات وتدخلات مختلفة، ولا يوجد تحقق مصري للغة أو سلامة وقف الحلقة ذاتيًا. قد يزيد التسجيل الاجترار لبعض الناس.",
    "optionalDeepDiveAr": {
      "applicable": true,
      "textAr": "راجع SRC-ZETSCHE-2018-RNT-CONTROL لحجم وحدود ارتباط التحكم، وSRC-MCCARRICK-2021-RUMINATION-WORRY لفروق التدخل والتقديم المهني."
    },
    "completionWithoutPerfectionAr": "يكفي ملاحظة عدم وجود جديد أو اختيار توقف. لا يلزم اختفاء السؤال أو الشعور أو تنفيذ حل، وعودة الحلقة لا تلغي الإكمال."
  }
}
