{
  "dayId":"DAY-TRACK-HUMAN-001-065","trackId":"TRACK-HUMAN-001","version":"0.1.0-draft","status":"RESEARCHED","professionalReview":"PENDING",
  "outlineRefs":{"capabilityIds":["CAP-004","CAP-025","CAP-026"],"claimIds":["CLM-RELATIONSHIP-001","CLM-SELF-RESPECT-001"],"patternIds":["PAT-017","PAT-018","PAT-039"],"practiceFamilyIds":["PRACTICE-COMMUNICATION-SCRIPT"],"prerequisites":[4,28,53,64]},
  "content":{
    "dayNumber":65,"titleAr":"الدفاعية تحمي الصورة وتمنع المعلومة",
    "objectiveAr":"بنهاية اليوم تستطيع التقاط جزء قابل للفحص أو طرح سؤال واضح في نقد منخفض الخطر، دون اعتراف قسري بكل الاتهام أو اختصار قيمتك في الخطأ.",
    "definitionSimpleAr":"الدفاعية استجابة تحاول حماية صورتك سريعًا بالإنكار أو التبرير أو الهجوم، وقد تمنعك من فحص معلومة مفيدة.",
    "definitionDeepAr":"ليست كل دفاعية سيئة ولا كل نقد صحيح. قد تحميك الاستجابة من إهانة أو اتهام أو سلطة غير عادلة. في موقف آمن نفصل ثلاثة أشياء: الواقعة القابلة للفحص، تفسير الناقد، وطريقة قوله. يمكن قبول جزء وتصحيح جزء ورفض إهانة. احترام الذات يسمح بتقييم الفعل من دون تحويله لهوية، ولا يلزم الاعتراف الفوري أو الإفصاح أو الاتفاق.",
    "notThisAr":"هذا ليس مطالبة بتقبل الإساءة أو الاعتراف، ولا قولًا إن الناقد محايد، ولا تدريبًا على تقييم رسمي أو اتهام قانوني من دون دعم.",
    "roleRelevanceAr":"في العمل والأسرة والصداقة، التقاط معلومة واحدة قد يفتح تصحيحًا، بينما الحد يمنع أن تتحول التغذية الراجعة إلى محاكمة شخصية أو إذلال.",
    "researchSaysAr":"تظهر برامج التواصل آثارًا متواضعة وسياقية، بينما لا تثبت تدخلات تقدير الذات منافع سلوكية واسعة. يدعم ذلك فحص الفعل بكرامة، لا رفع صورة الذات أو قبول النقد تلقائيًا.",
    "researchDoesNotProveAr":"لا تثبت الأدلة أن تقليل الدفاعية يحسن الأداء أو العلاقة، أو أن النقد صحيح، أو أن السؤال الهادئ آمن مع السلطة، أو أن الثقة بالنفس مطلوبة لتلقي المعلومة.",
    "commonMisunderstandingAr":"قد تظن أن قول «في جزء صحيح» يعني قبول كل الاتهام. يمكنك تحديده بدقة: «صحيح أني تأخرت، ومش موافق على وصف الإهمال كصفة».",
    "healthyExampleAr":"قلت: «صحيح إني ما حدثتش الموعد. محتاج مثالًا على أثر ده، ومش هكمل الكلام لو فيه إهانة».",
    "unhealthyExampleAr":"رددت بخطأ الطرف الآخر فورًا، أو اعتذرت عن كل شيء لإنهاء الضغط، أو سجلت نقدًا مهينًا كحقيقة عن نفسك.",
    "egyptianContextExampleAr":"مع الأكبر سنًا أو المدير قد يصعب التصحيح المباشر؛ يمكنك طلب مثال أو وقت للمراجعة أو قناة مكتوبة، ولا يلزم نقاش الهوية والاحترام أمام جمهور.",
    "selfCheckQuestionsAr":["هل المصدر والموقف آمنان بما يكفي؟","ما الواقعة أو المثال القابل للفحص؟","ما التفسير أو الصفة التي لا يلزم قبولها؟","ما السؤال الذي يوضح الأثر أو المعيار؟","هل أحتاج وقتًا أو وسيطًا أو قناة رسمية؟"],
    "action5MinAr":"اكتب ردًا: «الجزء اللي أقدر أراجعه هو… ومحتاج مثالًا على… ولن أقبل…». استخدم حالة خيالية.",
    "action15MinAr":"قسّم نقدًا إلى واقعة وتفسير وطريقة. اختر قبولًا جزئيًا أو سؤالًا أو حدًا لكل طبقة.",
    "fullPracticeAr":"اختر نقدًا منخفض الحساسية من مصدر مناسب. لاحظ اندفاع الرد، وخذ توقفًا إن لزم. اكتب الواقعة والتفسير والطريقة، ثم تحقق من مثال واحد أو معيار. صغ ردًا يقبل ما ثبت، يسأل عما ينقص، ويرفض الإهانة. لا ترسله إذا كانت القوة أو العواقب تحتاج مشورة أو توثيقًا.",
    "whatNotToDoAr":["لا تقلب النقد فورًا على خطأ الناقد.","لا تعترف بواقعة غير معروفة لتخفيف الضغط.","لا تبرر طويلًا أو تكشف معلومات لا تلزم.","لا تستخدم التدريب مع ابتزاز أو تحرش أو اتهام قانوني دون دعم."],
    "patternToWatchAr":"راقب جملة «آه بس إنت…»، أو شرح النية بدل الأثر، أو قبول كل شيء خوفًا من الرفض.",
    "patternInterruptionAr":"اطلب مثالًا واحدًا، سم جزءًا يمكنك فحصه، وخذ وقتًا قبل الرد. ضع حدًا للطريقة إذا لزم.",
    "microExperimentAr":"في ملاحظة بسيطة، قل «هراجع الجزء ده» بدل الدفاع أو الاعتذار الشامل، ثم تحقق لاحقًا.",
    "realWorldMissionAr":"اطلب مثالًا أو معيارًا واحدًا من نقد منخفض الخطر، أو اختر عدم الرد حتى تراجع المعلومة.",
    "relationshipPracticeAr":{"applicable":true,"textAr":"قل: «أقدر أراجع الواقعة دي. اديني مثالًا محددًا على الأثر. مش موافق على الصفة، ومحتاج نحافظ على الاحترام»."},
    "environmentChangeAr":"دوّن واقعة ومعيارًا فقط في قناة آمنة، لا حكمًا على الذات ولا تفاصيل حساسة. استخدم توثيقًا رسميًا عند الحاجة.",
    "fullModeAr":"افصل طبقات النقد وصغ قبولًا وسؤالًا وحدًا وتدرب. الزمن 20–25 دقيقة.",
    "standardModeAr":"حدد واقعة وسؤالًا وحدًا واحدًا. الزمن 8–12 دقيقة.",
    "minimumModeAr":"قل «هراجع الكلام وأرد لاحقًا» أو اكتب الجزء القابل للفحص فقط.",
    "failureResponseAr":"إذا هاجمت أو اعترفت زيادة، صحح عند الأمان: «ردي كان دفاعيًا/واسعًا. الجزء المحدد اللي هراجعه…». لا تعاقب نفسك أو تكمل نقاشًا مهينًا.",
    "tooEasyAr":"افحص نقدًا يجمع جزءًا صحيحًا وصفة ظالمة وطريقة مهينة، وصغ ردًا مستقلًا لكل جزء.",
    "tooHardAr":"استخدم مثالًا خياليًا عن تأخر موعد وحدد الواقعة فقط.",
    "reflectionAr":"ما المعلومة التي كدت تفقدها؟ وما الذي كدت تعترف به فقط لحماية الصورة أو العلاقة؟",
    "journalPromptsAr":["كيف أحمي صورتي بالهجوم؟","أي مصدر نقد أعطيه سلطة أكبر من حقه؟","ما الفرق بين مراجعة فعل ومحاكمة قيمة؟"],
    "noticeTomorrowAr":"لاحظ فعلًا محددًا يحتاج اعتذارًا، وافصل المسؤولية والإصلاح عن إذلال الذات أو طلب الغفران.",
    "tomorrowPreparationAr":"اختر خطأ منخفض المخاطر قابلًا للإصلاح، لا اعترافًا قانونيًا أو صدمة أو عنفًا.",
    "roleSpecificAdaptationAr":"لصاحب السلطة، النقد ليس آمنًا لمجرد هدوء صوتك؛ أعط مثالًا وحق رد. لمن سلطته أقل، اطلب وقتًا أو ممثلًا ولا تعترف بما يحتاج مشورة.",
    "specialContextAdaptationsAr":["مع تحرش أو تمييز: لا تحول البلاغ إلى تمرين دفاعية للمتضرر؛ استخدم قناة ودعمًا مناسبين.","مع اتهام قانوني أو مهني كبير: اطلب مشورة قبل رد أو اعتراف.","مع عنف أو تهديد: لا تناقش النقد؛ انتقل للأمان.","مع طفل: انتقد الفعل لا الهوية واسمح بالتصحيح.","مع جهاز مشترك: لا تحفظ النقد أو اعترافات حساسة."],
    "safetyNoteAr":{"applicable":true,"textAr":"لا تستخدم التدريب للقبول بإهانة أو ضغط أو اعتراف عالي العواقب. خذ وقتًا ودعمًا عند السلطة أو التهديد أو المخاطر القانونية."},
    "professionalHelpThresholdAr":{"applicable":true,"textAr":"إذا كان النقد جزءًا من إساءة أو سيطرة أو يسبب ضيقًا وتعطّلًا شديدًا، فاطلب دعمًا متخصصًا أو رسميًا مناسبًا وعاجلًا عند الخطر."},
    "primarySourceIds":["SRC-BLANCHARD-2009-COUPLE-COMMUNICATION","SRC-OMURA-2017-ASSERTIVENESS","SRC-NIVEAU-2021-SELF-ESTEEM"],
    "additionalSourceIds":["SRC-HAN-2023-SELF-COMPASSION"],
    "evidenceStrength":{"rating":"LIMITED","explanationAr":"الأدلة تدعم آثارًا متواضعة للتواصل وتغيرًا محدودًا في مقاييس الذات، لكنها لا تثبت تمرين استقبال النقد أو أثره السلوكي."},
    "researchLimitationAr":"الدراسات غير مصرية ومتغايرة ولا تمثل نقد العمل والأسرة والسلطة أو الاتهامات عالية العواقب. معنى الكرامة والدفاعية يحتاج اختبارًا لغويًا محليًا.",
    "optionalDeepDiveAr":{"applicable":true,"textAr":"راجع SRC-BLANCHARD-2009-COUPLE-COMMUNICATION وSRC-OMURA-2017-ASSERTIVENESS للتواصل، وSRC-NIVEAU-2021-SELF-ESTEEM لحدود مقاييس الذات."},
    "completionWithoutPerfectionAr":"يكفي طلب وقت أو مثال أو تحديد جزء قابل للفحص أو رفض الإهانة. لا يلزم الاتفاق أو الاعتراف أو الرد الفوري."
  }
}
