{
  "dayId":"DAY-TRACK-HUMAN-001-082","trackId":"TRACK-HUMAN-001","version":"0.1.0-draft","status":"RESEARCHED","professionalReview":"PENDING",
  "outlineRefs":{"capabilityIds":["CAP-021","CAP-020"],"claimIds":["CLM-FAILURE-LEARNING-001"],"patternIds":["PAT-029","PAT-032"],"practiceFamilyIds":["PRACTICE-ERROR-REVIEW"],"prerequisites":[49,67,81]},
  "content":{
    "dayNumber":82,"titleAr":"راجع خطأً آمنًا بمعلومة وتصحيح ومحاولة","objectiveAr":"أن يراجع المتعلم خطأ منخفض المخاطر ويحدد معلومة جديدة وتصحيحًا واختبارًا آمنًا واحدًا.",
    "definitionSimpleAr":"مراجعة الخطأ الآمن تفصل الواقعة عن الهوية، تستخرج معلومة قابلة للاستخدام، ثم تصحح النظام وتجرب مرة واحدة.",
    "definitionDeepAr":"لا يكفي قول «تعلمت». نحدد الهدف والمعلومة المتاحة والفعل والنتيجة، ثم نبحث عن آلية لا وصمة: إشارة غابت، خطوة معقدة، تحقق لم يحدث، أو مورد ناقص. التصحيح قد يكون قائمة أو طلب توضيح أو جرعة أصغر. الاختبار يجب أن يكون منخفض العواقب وقابلًا للتوقف؛ الخطأ الطبي أو القانوني أو الذي أضر شخصًا يحتاج إجراءات ومساءلة لا تدريبًا ذاتيًا فقط.",
    "notThisAr":"هذا ليس إعادة تمثيل لأذى أو اعترافًا قانونيًا أو طريقة لتجاوز الاعتذار والإصلاح، ولا احتفالًا بالخطأ في كل سياق.",
    "roleRelevanceAr":"تحويل الخطأ إلى معلومة وتصحيح يقلل جلد الذات والتكرار معًا، من غير إنكار الأثر أو تحويل النتيجة إلى هوية.",
    "researchSaysAr":"يدعم تدريب إدارة الخطأ الأداء في مهام تعلم محددة حين يسمح السياق بالتجريب والتغذية الراجعة، لكن أثره لا يعمم إلى قرارات الحياة عالية المخاطر.",
    "researchDoesNotProveAr":"لا تثبت الأدلة أن كل خطأ مفيد أو أن المحاولة التالية ستنجح، ولا أن مراجعة فردية تكفي حين تضرر آخر أو فشل النظام.",
    "commonMisunderstandingAr":"التصحيح ليس وعد «لن أكرر أبدًا»؛ هو تغيير محدد في الإشارة أو الخطوة أو التحقق يمكن اختباره.",
    "healthyExampleAr":"نسيت مرفقًا غير حساس، فحددت أن الإرسال سبق فحص القائمة، أضفت خطوة تحقق، واختبرتها على رسالة تجريبية.",
    "unhealthyExampleAr":"كتبت «أنا مهمل»، أو كررت الموقف الخطر لتتعلم، أو استخدمت التحليل بدل الاعتذار وتصحيح أثر على شخص.",
    "egyptianContextExampleAr":"مع ضغط مواصلات وطلبات متداخلة قد يكون التصحيح تغيير ترتيب أو سؤال أولوية، لا إضافة جلد أو قائمة طويلة لا تناسب الواقع.",
    "selfCheckQuestionsAr":["هل المثال آمن ومناسب للمراجعة الذاتية؟","ما الهدف والمعلومة المتاحة وقتها؟","ما الآلية الأقرب للخطأ؟","ما التصحيح الأصغر؟","كيف أختبره بلا ضرر؟"],
    "action5MinAr":"اكتب خمس خانات لخطأ بسيط: هدف، فعل، نتيجة، معلومة جديدة، وتصحيح.",
    "action15MinAr":"أضف عامل النظام والقيد، وصمم اختبارًا خياليًا منخفض المخاطر مع علامة توقف ومعيار ملاحظة.",
    "fullPracticeAr":"اختر خطأ قديمًا صغيرًا لم يسبب أذى. صف الهدف والسياق والمعلومات والفعل والنتيجة بلا أوصاف شخصية. حدد عاملًا فرديًا وعامل بيئة أو نظام ومعلومة لم تكن متاحة. اكتب تصحيحين واختر الأصغر، ثم نفذ اختبارًا تجريبيًا أو خياليًا مرة واحدة. راجع إن غيّر الآلية لا إن جعلك كاملًا، وحدد متى يلزم اعتذار أو مسار رسمي.",
    "whatNotToDoAr":["لا تختبر خطأ طبيًا أو قانونيًا أو ماليًا عالي المخاطر.","لا تستخدم المراجعة بدل الاعتذار أو الإصلاح.","لا تعمم من محاولة واحدة.","لا تحوّل الآلية إلى عيب ثابت."],
    "patternToWatchAr":"راقب وصف الهوية أو وعد الكمال أو تحليلًا طويلًا بلا تعديل واحد قابل للاختبار.",
    "patternInterruptionAr":"اسأل: ما الإشارة أو الخطوة التي ستتغير في المحاولة المقبلة؟ إن لم تجد، اجمع معلومة أو اطلب دعمًا.",
    "microExperimentAr":"اختبر التصحيح على محاكاة أو مهمة غير حساسة مرة واحدة، وسجل هل ظهر السلوك المطلوب لا شعور الثقة.",
    "realWorldMissionAr":"طبق قائمة تحقق أو وقفة واحدة على مهمة منخفضة المخاطر؛ توقف إذا ظهرت عاقبة غير متوقعة.",
    "relationshipPracticeAr":{"applicable":false,"textAr":"لا يلزم إشراك المتضرر في تجربتك؛ الاعتذار والإصلاح، إن لزما، منفصلان عن هذا التمرين."},
    "environmentChangeAr":"غيّر إشارة واحدة: قائمة قصيرة أو مكان أداة أو خطوة مراجعة، وتجنب نظامًا معقدًا يصنع خطأً جديدًا.",
    "fullModeAr":"أكمل التحليل والتصحيح والاختبار والمراجعة خلال 25 دقيقة.",
    "standardModeAr":"حدد المعلومة والتصحيح واختبارًا خياليًا خلال عشر دقائق.",
    "minimumModeAr":"استبدل حكم الهوية بوصف واقعة وحدد معلومة جديدة فقط.",
    "failureResponseAr":"إن تكرر الخطأ، لا تضاعف اللوم. راجع هل استهدف التصحيح الآلية أو هل تحتاج موردًا أو إشرافًا أو إيقاف المهمة.",
    "tooEasyAr":"حلل تفاعل ثلاثة عوامل وحدد كيف يمنع النظام الاعتماد على الذاكرة أو النية وحدهما.",
    "tooHardAr":"استخدم مثال نسيان غرض بسيط واختر إشارة مكانية واحدة.",
    "reflectionAr":"ما المعلومة الجديدة فعلًا؟ وهل صححت الآلية أم كتبت وعدًا أخلاقيًا؟",
    "journalPromptsAr":["ماذا كنت أعرف وقتها؟","أي جزء من النظام ساهم؟","ما الاختبار الآمن التالي؟"],
    "noticeTomorrowAr":"لاحظ قرارًا قابلًا للرجوع تؤجله بحثًا عن معلومة لن تغير الخطوة الأولى.",
    "tomorrowPreparationAr":"اختر قرارًا منخفض المخاطر له حد معلومات وحق توقف واضح.",
    "roleSpecificAdaptationAr":"للفرق، راجع النظام بلا فضح فرد؛ وللمتعلم المنفرد استخدم محاكاة، ولصاحب السلطة أصلح الظروف لا سلوك الأقل سلطة فقط.",
    "specialContextAdaptationsAr":["مع أذى لشخص: قدّم الأمان والاعتذار والإصلاح والمساءلة.","مع خطأ مهني منظم: اتبع بروتوكول الإبلاغ والإشراف.","مع ذاكرة متأثرة: استخدم دعمًا خارجيًا واطلب تقييمًا عند التعطل.","مع وسواس مراجعة: حد محاولة واحدة وتوقف.","مع جهاز مشترك: لا تسجل تفاصيل عمل أو أشخاص."],
    "safetyNoteAr":{"applicable":true,"textAr":"استخدم أخطاء منخفضة المخاطر فقط. لا تعِد تنفيذ خطر، ولا تستبدل إجراءات السلامة أو الإبلاغ أو الإصلاح بتمرين شخصي."},
    "professionalHelpThresholdAr":{"applicable":true,"textAr":"خطأ ذو أثر صحي أو قانوني أو أمني أو مهني كبير يحتاج إشرافًا أو جهة مختصة وإجراءات رسمية مناسبة."},
    "primarySourceIds":["SRC-KEITH-2008-ERROR-MANAGEMENT","SRC-MACNAMARA-2023-GROWTH-MINDSET","SRC-HAN-2023-SELF-COMPASSION"],
    "additionalSourceIds":["SRC-AGARWAL-2021-RETRIEVAL-CLASSROOM","SRC-PEINADO-2020-DISPARITY-MESSAGING"],
    "evidenceStrength":{"rating":"MODERATE","explanationAr":"إدارة الخطأ مدعومة في تعلم المهارات، مع حدود كبيرة للنقل والسياقات التي لا تسمح بالتجريب."},
    "researchLimitationAr":"لا تختبر الأدلة هذا القالب العربي أو الأخطاء اليومية المعقدة، ولا تحدد مسؤولية أو إصلاحًا مناسبًا في حالة حقيقية.",
    "optionalDeepDiveAr":{"applicable":true,"textAr":"راجع SRC-KEITH-2008-ERROR-MANAGEMENT لنطاق تدريب الخطأ وSRC-MACNAMARA-2023-GROWTH-MINDSET للتحذير من وعود عقلية عامة."},
    "completionWithoutPerfectionAr":"يكفي وصف الواقعة أو معلومة واحدة؛ لا يلزم إعادة المحاولة أو ضمان عدم التكرار."
  }
}
