{
  "dayId":"DAY-TRACK-HUMAN-001-049","trackId":"TRACK-HUMAN-001","version":"0.1.0-draft","status":"RESEARCHED","professionalReview":"PENDING",
  "outlineRefs":{"capabilityIds":["CAP-020","CAP-021","CAP-012"],"claimIds":["CLM-FAILURE-LEARNING-001","CLM-SELF-COMPASSION-001"],"patternIds":["PAT-009","PAT-010","PAT-028"],"practiceFamilyIds":["PRACTICE-ERROR-REVIEW"],"prerequisites":[41,42,43,44,45,46,47,48]},
  "content":{
    "dayNumber":49,"titleAr":"التعثر بيانات لا حكم نهائي",
    "objectiveAr":"بنهاية اليوم تستطيع مراجعة تعثر منخفض المخاطر بحسب السياق والاحتكاك والجرعة والمهارة، ثم تعديل متغير واحد، مع استبعاد الفقد والظلم والإساءة والضرر غير القابل للعكس.",
    "definitionSimpleAr":"التعثر نتيجة لم تسر كما قصدت؛ قد تعطي معلومة إذا كان الموقف آمنًا للمراجعة ويوجد تصحيح أو محاولة مناسبة.",
    "definitionDeepAr":"التعلم من الخطأ يحتاج واقعة محددة وتغذية راجعة وتصحيحًا وفرصة آمنة، لا شعارًا أن كل فشل مفيد. نراجع أربعة مواضع: السياق، والاحتكاك، والجرعة، والمهارة. ثم نفرق بين خطأ نملكه، وقيد لم نملكه، وضرر يحتاج إصلاحًا، وفقد أو ظلم لا يجوز تحويله إلى درس. قد يكون القرار الصحيح عدم إعادة المحاولة أو طلب إشراف مؤهل.",
    "notThisAr":"هذا ليس «عقلية نمو» سحرية، ولا مطالبة بالامتنان للأذى، ولا تبرئة للخطأ، ولا إعادة تعرّض للخطر، ولا تفسيرًا للفقد أو الظلم كفرصة.",
    "roleRelevanceAr":"بعد عادة انقطعت أو مهمة لم تبدأ، تمنع المراجعة إما جلد الذات أو تكرار الخطة نفسها. لكنها تتوقف عندما تصبح المسألة سلامة أو حقًا أو خسارة لا تُعكس.",
    "researchSaysAr":"يمكن لإدارة الأخطاء في التدريب أن تدعم التعلم حين يتبع الخطأ تغذية راجعة وتصحيح ومحاولة، لكن أدلة رسائل عقلية النمو العامة على التحصيل قليلة الموثوقية. كما أن بعض ممارسات التأمل قد تسبب آثارًا سلبية، لذا لا نضغط على إعادة التجربة أو الاستبطان.",
    "researchDoesNotProveAr":"لا تثبت الأدلة أن كل خطأ مفيد، أو أن مراجعة ذاتية تكفي، أو أن التعاطف يمنع التكرار، أو أن الضحية مسؤولة عن استخراج تعلم، أو أن محاولة أخرى آمنة.",
    "commonMisunderstandingAr":"قد تقفز إلى «ماذا تعلمت؟» قبل السؤال «هل كان هذا خطأً قابلًا للتجربة أم ضررًا أو ظلمًا أو فقدًا؟». تحديد النوع يسبق استخراج الدرس.",
    "healthyExampleAr":"لم تبدأ مهمة لأن خطوتها الأولى كانت كبيرة؛ قللت الجرعة وحددت ملفًا واحدًا للمحاولة القادمة، من دون محو أثر التأخير على شريك العمل.",
    "unhealthyExampleAr":"عدت لموقف مهين كي تثبت أنك تعلمت، أو وصفت إصابة أو فقدًا بأنه درس، أو أخفيت ضررًا حقيقيًا وراء عبارة «كلنا بنغلط».",
    "egyptianContextExampleAr":"إذا تعطلت معاملة بسبب إجراء غير واضح، راجع ما يمكنك تحضيره لكن لا تحمل نفسك مسؤولية نظام أو تكلفة أو واسطة خارج سيطرتك.",
    "selfCheckQuestionsAr":["هل الموقف آمن وقابل للعكس بما يكفي للمراجعة؟","ما الواقعة المحددة بعيدًا عن وصف هويتي؟","هل العائق سياق أم احتكاك أم جرعة أم مهارة؟","من تأثر وهل يلزم إصلاح أو اعتذار أو دعم؟","ما متغير واحد أعدله، أم هل الأفضل عدم إعادة المحاولة؟"],
    "action5MinAr":"اكتب: «حدث… والعامل الأقرب… والتعديل الآمن المحتمل…». إذا كان فقدًا أو ظلمًا أو إساءة، اكتب «لا مراجعة تعليمية» وتوقف.",
    "action15MinAr":"افصل أربعة أعمدة: تحت سيطرتي، خارج سيطرتي، أثر يحتاج إصلاحًا، وما أحتاجه قبل محاولة أخرى. اختر تعديلًا واحدًا فقط.",
    "fullPracticeAr":"اختر تعثرًا بسيطًا حديثًا، لا صدمة ولا أذى. صف الواقعة والنتيجة ومن تأثر. افحص السياق والاحتكاك والجرعة والمهارة، واطلب تغذية راجعة آمنة إن كانت لازمة. حدد تصحيحًا للأثر وتعديلًا واحدًا ومحاولة منخفضة العواقب أو سببًا لعدم المحاولة. ضع علامة توقف إذا عاد جلد الذات أو ظهر خطر أو معلومات تحتاج مختصًا.",
    "whatNotToDoAr":["لا تراجع صدمة أو إساءة أو فقدًا كتمرين تعلم.","لا تعاود تجربة طبية أو قانونية أو مالية أو خطرة دون إشراف مؤهل.","لا تستخدم التعاطف لإلغاء إصلاح الضرر.","لا تجبر المتأثر على مسامحتك أو تقديم تغذية راجعة."],
    "patternToWatchAr":"راقب التحول من واقعة إلى هوية «أنا فاشل»، أو العكس إلى إنكار الأثر «مجرد تجربة»، ثم تكرار الخطة بلا تغيير.",
    "patternInterruptionAr":"سم الواقعة والأثر وحد السيطرة. أصلح حيث يلزم، وعدّل متغيرًا واحدًا، واترك الهوية والعبارات البطولية خارج التحليل.",
    "microExperimentAr":"على خطأ صغير، غيّر متغيرًا واحدًا فقط في محاولة آمنة، ولاحظ هل ظهرت معلومة جديدة لا هل أثبتّ قيمتك.",
    "realWorldMissionAr":"نفذ إصلاحًا بسيطًا أو تصحيحًا أو اطلب معلومة قبل محاولة جديدة، واحترم حق المتأثر في عدم الرد أو القبول.",
    "relationshipPracticeAr":{"applicable":true,"textAr":"قل عند الأمان: «اللي حصل كان… وأثره… ومسؤوليتي… وهصلحه بكذا». لا تضف تبريرًا ولا تطلب طمأنة أو غفرانًا فوريًا."},
    "environmentChangeAr":"أزل عائقًا واحدًا أو أضف خطوة تحقق قبل المحاولة، مع الحفاظ على الخصوصية وعدم تخزين اعتراف حساس.",
    "fullModeAr":"راجع الواقعة والأثر والعوامل والتصحيح والتعديل وحد المحاولة. الزمن 20–30 دقيقة.",
    "standardModeAr":"حدد الواقعة وعاملًا وإصلاحًا أو تعديلًا واحدًا. الزمن 8–12 دقيقة.",
    "minimumModeAr":"قل «ده تعثر محدد، مش حكم نهائي» وحدد التوقف أو الإصلاح فقط.",
    "failureResponseAr":"إذا تحولت المراجعة إلى جلد أو استدعاء أذى، توقف. لا تستخرج درسًا؛ استخدم دعمًا آمنًا أو مهنيًا، ونفذ إصلاحًا فقط إذا كان مناسبًا وآمنًا.",
    "tooEasyAr":"قارن بين خطأ قابل للتجربة وضرر لا يجوز تكراره، وحدد لماذا تختلف التغذية الراجعة والمحاولة التالية.",
    "tooHardAr":"استخدم مثالًا خياليًا عن نسيان أداة بسيطة وحدد العامل والتعديل فقط.",
    "reflectionAr":"ما الذي كان تحت سيطرتك وما الذي لم يكن؟ هل يحتاج الموقف تعلمًا أم إصلاحًا أم حزنًا أم توقفًا؟",
    "journalPromptsAr":["متى أحول التعثر إلى هوية؟","ما الضرر الذي يحتاج إصلاحًا قبل التعلم؟","ما الموقف الذي لا يحق لأحد مطالبتي بتحويله إلى درس؟"],
    "noticeTomorrowAr":"لاحظ العناصر التي ستدخل دورة أسبوعية صغيرة: فعل وبيئة ومتابعة اختيارية وراحة وخطة عودة.",
    "tomorrowPreparationAr":"اختر تجربة أسبوعية منخفضة المخاطر يمكن إلغاؤها ولا تعتمد على استمرار يومي أو بيانات حساسة.",
    "roleSpecificAdaptationAr":"لصاحب السلطة، وفر أمانًا وتغذية راجعة ولا تجبر التابع على اعتراف. لمن سلطته أقل، لا تفصح عن خطأ لمن قد ينتقم قبل مشورة أو قناة آمنة.",
    "specialContextAdaptationsAr":["مع إساءة أو عنف: لا تواجه ولا تعاود التجربة؛ ركز على الأمان والدعم.","مع فقد أو ظلم: لا تبحث عن درس إلزامي؛ اعترف بالأثر والاحتياج.","مع خطأ طبي أو قانوني أو مالي: اطلب مشورة مؤهلة قبل أي اعتراف أو محاولة.","مع إيذاء ذات أو تعاطٍ أو اضطراب أكل: لا تستخدم تجربة ذاتية؛ اطلب دعمًا متخصصًا.","مع جهاز مشترك: لا تحفظ اعترافًا أو أسماء أو تفاصيل قد تستخدم ضدك أو غيرك."],
    "safetyNoteAr":{"applicable":true,"textAr":"استبعد الصدمة والعنف والإساءة والفقد والضرر غير القابل للعكس والطب والقانون والمال. عند خطر أو إيذاء، أوقف المراجعة وانتقل للمساعدة المناسبة."},
    "professionalHelpThresholdAr":{"applicable":true,"textAr":"إذا كان التعثر مرتبطًا بإيذاء ذات أو عنف أو صدمة شديدة أو تعاطٍ أو قهر أو ضيق وتعطّل مستمر، اطلب مساعدة مهنية وعاجلة عند الخطر."},
    "primarySourceIds":["SRC-KEITH-2008-ERROR-MANAGEMENT","SRC-MACNAMARA-2023-GROWTH-MINDSET","SRC-HAN-2023-SELF-COMPASSION"],
    "additionalSourceIds":["SRC-FARIAS-2020-MEDITATION-ADVERSE"],
    "evidenceStrength":{"rating":"MIXED","explanationAr":"توجد أدلة على التعلم من أخطاء تدريبية آمنة، مع counterevidence قوي ضد رسائل النمو العامة وحدود للتعاطف والاستبطان؛ النقل لهذا التمرين غير مثبت."},
    "researchLimitationAr":"الأدلة تدريبية وتعليمية وغير مصرية غالبًا، ولا تحدد أمان الإفصاح أو المحاولة في علاقات السلطة أو الخسائر الواقعية. التوليف يحتاج مراجعة محلية ومهنية.",
    "optionalDeepDiveAr":{"applicable":true,"textAr":"راجع SRC-KEITH-2008-ERROR-MANAGEMENT لشروط التعلم من الخطأ، وSRC-MACNAMARA-2023-GROWTH-MINDSET لحدود الرسائل العامة، وSRC-FARIAS-2020-MEDITATION-ADVERSE للآثار السلبية المحتملة."},
    "completionWithoutPerfectionAr":"يكفي تحديد أن الموقف غير مناسب للمراجعة، أو تسمية عامل، أو إصلاح واحد. لا يلزم درس أو محاولة أخرى أو مسامحة أو شعور أفضل."
  }
}
