{
  "dayId": "DAY-TRACK-HUMAN-001-032",
  "trackId": "TRACK-HUMAN-001",
  "version": "0.1.0-draft",
  "status": "RESEARCHED",
  "professionalReview": "PENDING",
  "outlineRefs": {
    "capabilityIds": ["CAP-002", "CAP-003", "CAP-010"],
    "claimIds": ["CLM-EMOTION-001", "CLM-DECISION-CONTEXT-001"],
    "patternIds": ["PAT-020", "PAT-046"],
    "practiceFamilyIds": ["PRACTICE-OBSERVE-NAME"],
    "prerequisites": [31]
  },
  "content": {
    "dayNumber": 32,
    "titleAr": "الشعور والمعلومة والفعل ثلاث طبقات",
    "objectiveAr": "بنهاية اليوم تستطيع الفصل بين وجود انفعال، وما قد يشير إليه، وما تختار فعله، مع تأجيل الفعل عند الحاجة.",
    "definitionSimpleAr": "الشعور تجربة حقيقية، لكنه لا يثبت تفسيرًا كاملًا ولا يفرض فعلًا؛ يمكن سماع الإشارة ثم اختيار الاستجابة.",
    "definitionDeepAr": "قد يشير الخوف إلى خطر أو عدم يقين أو ذكرى، والغضب إلى حد أو ظلم أو إحباط، والحزن إلى فقد أو إرهاق، لكن الإشارة ليست تشخيصًا للسبب. نفصل: «أشعر بـ…»، «قد يخبرني عن…»، «سأفعل أو لن أفعل…». ثم نفحص الواقع والحقوق والسلطة والأمان. احترام الشعور يعني عدم إنكاره، واحترام الآخرين يعني عدم استخدامه ترخيصًا للإيذاء.",
    "notThisAr": "هذا ليس كبتًا أو تجاهلًا للحدس، ولا قاعدة أن المشاعر غير عقلانية، ولا دعوة للتصرف دائمًا عكسها، ولا علاجًا لتنظيم الانفعال.",
    "roleRelevanceAr": "في خلاف أو قرار، يمنح الفصل وقتًا لسؤال وتوضيح أو حد آمن بدل تحويل الشعور إلى اتهام أو أمر أو اندفاع.",
    "researchSaysAr": "ترتبط استراتيجيات تنظيم الانفعال بمؤشرات نفسية، لكن العلاقات تختلف بالسياق ولا تثبت استراتيجية عالمية أفضل أو سببية بسيطة. كما قد يغير الضغط بعض عمليات القرار بحسب المهمة والتوقيت. لذلك لا يطلب متزن تجاهل الشعور ولا طاعته، بل يضيف فحص سياق وخيارًا قابلًا للمراجعة.",
    "researchDoesNotProveAr": "لا تثبت الأدلة أن الفصل يحسن كل قرار، أو أن المشاعر معلومات دقيقة دائمًا، أو أن التأجيل آمن في الخطر، أو أن استراتيجية واحدة تناسب الثقافات والمواقف.",
    "commonMisunderstandingAr": "قد تقول «شعوري صحيح إذن تفسيري صحيح». الشعور لا يحتاج محكمة، لكن تفسير السبب أو نية الآخر يحتاج دليلًا منفصلًا.",
    "healthyExampleAr": "شعرت بخوف قبل مقابلة. اعتبرت أنه قد يشير لأهمية الموقف وعدم اليقين، فحضرت سؤالين ولم تلغِ أو تجبر نفسك على الهدوء.",
    "unhealthyExampleAr": "شعرت بالغضب فاعتبرت ذلك دليلًا قاطعًا أن الآخر يقصد الإهانة، وأرسلت رسالة جارحة فورًا.",
    "egyptianContextExampleAr": "في اجتماع أسري شعرت بالضغط عندما طُلب قرار سريع. لم تعتبر الشعور رفضًا نهائيًا؛ طلبت وقتًا ومعلومات مع مراعاة هل الرفض نفسه آمن.",
    "selfCheckQuestionsAr": [
      "ما الشعور التقريبي الآن؟",
      "ما الذي قد يشير إليه وما التفسير البديل؟",
      "ما الواقعة التي أحتاج فحصها؟",
      "ما الدافع الفوري وما عاقبته المحتملة؟",
      "ما فعل يحترم الشعور والحقوق والأمان؟"
    ],
    "action5MinAr": "اكتب ثلاثة أسطر: أشعر، قد يشير، أختار. استخدم «قد» ولا تنفذ فعلًا كبيرًا خلال التمرين.",
    "action15MinAr": "اختر موقفًا منخفض المخاطر وحدد الشعور والدافع والواقعة والتفسيرين وخيار فعل وتأجيل. افحص من يتأثر.",
    "fullPracticeAr": "صف موقفًا عاديًا وانفعالًا تقريبيًا. اكتب الإشارة المحتملة وما لا تثبته، ثم الدافع الفوري ونتيجته المحتملة. اقترح ثلاثة خيارات: فعل صغير، سؤال أو تواصل، وتوقف أو تأجيل. اختر وفق الأمان والقيم وقابلية الرجوع، وحدد علامة تغير القرار. لا تستخدم التمرين في خطر مباشر.",
    "whatNotToDoAr": [
      "لا تنكر الشعور لأنه لا يثبت التفسير.",
      "لا تستخدم الشعور تصريحًا لإيذاء أو إكراه.",
      "لا تؤجل الابتعاد أو طلب المساعدة عند خطر.",
      "لا تفحص كل تغير داخلي أو تبحث عن سبب واحد نهائي."
    ],
    "patternToWatchAr": "راقب الاستدلال الانفعالي: أشعر بالخطر إذن الخطر مؤكد، أو أشعر بالذنب إذن أنا مذنب، مع دمج التجربة بالدليل والفعل.",
    "patternInterruptionAr": "قل: «الشعور موجود، والتفسير احتمال، والفعل اختيار». افحص الخطر أولًا ثم اختر خطوة متناسبة.",
    "microExperimentAr": "أجّل ردًا عاديًا لدقيقتين وسمِّ الطبقات الثلاث، ثم اختر الرد أو عدمه. لاحظ وضوح الخيار لا اختفاء الشعور.",
    "realWorldMissionAr": "حوّل دافعًا واحدًا إلى فعل أقل ضررًا: سؤال بدل اتهام، مسودة غير مرسلة، خروج آمن، أو طلب وقت.",
    "relationshipPracticeAr": {
      "applicable": true,
      "textAr": "قل: «أنا حاسس بـ… وفاهم الموقف كذا، لكن ده تفسير؛ محتاج…». لا تطلب من الطرف قبول تفسيرك أو تحمل سلوك مؤذٍ."
    },
    "environmentChangeAr": "ضع تذكيرًا خاصًا بالطبقات الثلاث قرب قناة رد سريعة، مع إبقاء اتصال الطوارئ وعدم حفظ موقف حساس.",
    "fullModeAr": "حلل الطبقات والخيارات والمتأثرين ونفذ خطوة آمنة. الزمن 20–30 دقيقة.",
    "standardModeAr": "اكتب الشعور والإشارة والفعل واختر تأجيلًا أو خطوة. الزمن 8–12 دقيقة.",
    "minimumModeAr": "قل: «الشعور مش أمر». انتظر عشر ثوانٍ قبل فعل منخفض المخاطر أو لا تفعل شيئًا.",
    "failureResponseAr": "إذا تصرفت قبل الوقفة، لا تعاقب نفسك. افحص الأثر وأصلح ما يمكن، واجعل الخطوة المقبلة أصغر أو اطلب دعمًا.",
    "tooEasyAr": "اكتب كيف يمكن للشعور نفسه أن يقود أفعالًا مختلفة حسب القيمة والسلطة والأمان، من دون وصفة عامة.",
    "tooHardAr": "لا تحلل شعورًا. استخدم مثالًا خياليًا واكتب فقط «شعور ليس فعلًا»، ثم توقف.",
    "reflectionAr": "أي طبقة كانت تبتلع البقية: الشعور أم التفسير أم الدافع؟ وما الخيار الذي ظهر بعد الفصل؟",
    "journalPromptsAr": [
      "أي شعور أعامله كدليل كامل؟",
      "متى يكون الدافع مفهومًا والفعل غير مقبول؟",
      "ما التأجيل الذي يحمي ولا يتجنب؟"
    ],
    "noticeTomorrowAr": "لاحظ إشارة مبكرة واحدة قبل تصاعد الاستثارة: جسد أو لغة أو سرعة أو سلوك. لا تراقب طوال اليوم.",
    "tomorrowPreparationAr": "اختر خلافًا أو ضغطًا منخفض الحساسية يمكن ملاحظة بدايته من دون فتح مواجهة أو خطر.",
    "roleSpecificAdaptationAr": "في الإدارة أو الأبوة، لا تجعل انفعالك سلطة على الطرف الأضعف. في العمل، اختر قناة ووقتًا. في الخطر، قدم الابتعاد.",
    "specialContextAdaptationsAr": [
      "مع صدمة: قد تكون الإشارة مرتبطة بذكرى؛ لا تتحدى الخطر داخليًا وحدك.",
      "مع إكراه: لا تجعل التأجيل عودة لمصدر خطر.",
      "مع عرض جسدي: افصل التفسير واطلب تقييمًا عند القلق.",
      "مع صعوبة التسمية: استخدم دافعًا أو إحساسًا أو «غير واضح».",
      "مع قلة الخصوصية: لا تسجل تفاصيل العلاقة."
    ],
    "safetyNoteAr": {
      "applicable": true,
      "textAr": "في خطر أو تهديد، لا تنتظر تحليل الطبقات؛ ابتعد واطلب مساعدة مناسبة. توقف إذا زاد التركيز الداخلي الضيق أو الانفصال."
    },
    "professionalHelpThresholdAr": {
      "applicable": true,
      "textAr": "الاندفاع أو الانفعال الشديد المستمر أو المعطل أو المرتبط بإيذاء النفس أو الغير يستحق دعمًا مهنيًا وعاجلًا عند الخطر."
    },
    "primarySourceIds": ["SRC-HU-2014-EMOTION-REGULATION", "SRC-STARCKE-2016-STRESS-DECISIONS"],
    "additionalSourceIds": ["SRC-TORRE-2018-AFFECT-LABELING"],
    "evidenceStrength": {
      "rating": "MIXED",
      "explanationAr": "علاقات التنظيم والانفعال والقرار موثقة لكنها سياقية وارتباطية جزئيًا؛ نموذج الطبقات الثلاث تركيب تعليمي غير مختبر مصريًا."
    },
    "researchLimitationAr": "المراجعات لا تثبت استراتيجية عالمية أو سببية، والتصنيفات الثقافية واسعة. لم تختبر اللغة أو آثار التأجيل والأمان في مصر.",
    "optionalDeepDiveAr": {
      "applicable": true,
      "textAr": "راجع SRC-HU-2014-EMOTION-REGULATION لتغاير الاستراتيجيات والثقافة، وSRC-STARCKE-2016-STRESS-DECISIONS لتغير القرار حسب السياق."
    },
    "completionWithoutPerfectionAr": "يكفي فصل طبقتين أو تأجيل فعل. لا يلزم تنظيم الشعور أو معرفة رسالته أو تنفيذ أي تواصل."
  }
}
